{
  "budget": {
    "cap_micro_usd": 2000000,
    "spent_micro_usd": 31400
  },
  "calls": [
    {
      "cost_micro_usd": 15700,
      "duration_millis": 4210,
      "index": 0,
      "job": "propose",
      "model": {
        "name": "claude-sonnet-5",
        "provider": "anthropic"
      },
      "outcome": "none",
      "prompt_version": "propose.v1",
      "request_text": "You are reading sentences 0 to 4 of a recording...",
      "response_text": "{\"proposals\":[]}",
      "route": "cloud",
      "started_unix_millis": 1789700000000,
      "tokens": {
        "input": 812,
        "output": 9
      },
      "window_index": 0
    },
    {
      "cost_micro_usd": 15700,
      "detail": "the reply was not a JSON object",
      "duration_millis": 3900,
      "index": 1,
      "job": "propose",
      "model": {
        "name": "claude-sonnet-5",
        "provider": "anthropic"
      },
      "outcome": "malformed",
      "prompt_version": "propose.v1",
      "request_text": "You are reading sentences 10 to 14 of a recording...",
      "response_text": "Sure! Here are some ideas:",
      "route": "cloud",
      "started_unix_millis": 1789700004300,
      "tokens": {
        "input": 790,
        "output": 12
      },
      "window_index": 3
    }
  ],
  "producer": {
    "implementation": "clipmill-worker-editorial@0.1.0",
    "stage": "editorial-propose"
  },
  "schema_version": "clipmill.editorial.trace.v1",
  "source_fingerprint": "sha256:31ab000000000000000000000000000000000000000000000000000000000007"
}
